{
  "$schema": "https://json-schema.org/draft/2020-12/schema",
  "$id": "https://pact-spec.github.io/spec/schemas/taskspec.schema.json",
  "title": "PACT TaskSpec (0.3)",
  "type": "object",
  "required": [
    "description",
    "deliverable",
    "acceptance"
  ],
  "properties": {
    "description": {
      "type": "string",
      "minLength": 1
    },
    "inputs": {
      "type": "object",
      "properties": {
        "schema_uri": {
          "type": "string",
          "pattern": "^[A-Za-z][A-Za-z0-9+.-]*:[^\\s]+$"
        },
        "schema_hash": {
          "$ref": "common.schema.json#/$defs/hash"
        },
        "sample_uri": {
          "type": "string",
          "pattern": "^[A-Za-z][A-Za-z0-9+.-]*:[^\\s]+$"
        },
        "sample_hash": {
          "$ref": "common.schema.json#/$defs/hash"
        }
      },
      "dependentRequired": {
        "schema_uri": [
          "schema_hash"
        ],
        "sample_uri": [
          "sample_hash"
        ]
      },
      "$comment": "Section 5.1: every URI inside hash-committed content carries a sibling hash over the dereferenced bytes. The -01 schema required it only for the acceptance members and the -01 example broke the rule for the other three.",
      "additionalProperties": false
    },
    "deliverable": {
      "type": "object",
      "required": [
        "format"
      ],
      "properties": {
        "format": {
          "type": "string"
        },
        "schema_uri": {
          "type": "string",
          "pattern": "^[A-Za-z][A-Za-z0-9+.-]*:[^\\s]+$"
        },
        "schema_hash": {
          "$ref": "common.schema.json#/$defs/hash"
        }
      },
      "dependentRequired": {
        "schema_uri": [
          "schema_hash"
        ]
      },
      "additionalProperties": false
    },
    "acceptance": {
      "type": "object",
      "minProperties": 1,
      "required": [
        "thresholds"
      ],
      "dependentRequired": {
        "harness_uri": [
          "harness_hash"
        ],
        "rubric_uri": [
          "rubric_hash"
        ]
      },
      "properties": {
        "harness_uri": {
          "type": "string",
          "pattern": "^[A-Za-z][A-Za-z0-9+.-]*:[^\\s]+$"
        },
        "harness_hash": {
          "$ref": "common.schema.json#/$defs/hash"
        },
        "rubric_uri": {
          "type": "string",
          "pattern": "^[A-Za-z][A-Za-z0-9+.-]*:[^\\s]+$"
        },
        "rubric_hash": {
          "$ref": "common.schema.json#/$defs/hash"
        },
        "thresholds": {
          "type": "object",
          "minProperties": 1
        }
      },
      "$comment": "Section 5.2: members are the tier's; harness_uri and rubric_uri, when present, carry sibling hashes (dependentRequired). Not empty.",
      "additionalProperties": true
    },
    "constraints": {
      "type": "object"
    }
  },
  "additionalProperties": false
}
